{
    "version": "3.0",
    "description": "Restart safely removed media",
    "homepage": "http://www.uwe-sieber.de/drivetools_e.html",
    "license": "Freeware",
    "notes": "RestartSrDev.exe reports it's actually version 2.0.1",
    "architecture": {
        "32bit": {
            "bin": "Win32/RestartSrDev.exe"
        },
        "64bit": {
            "bin": "x64/RestartSrDev.exe"
        }
    },
    "url": "http://www.uwe-sieber.de/files/restartsrdev.zip",
    "hash": "55a28b8f7d974300b763e7a7ec675e2288600e9f095d5846a4ec56063c7b67b6",
    "checkver": "RestartSrDev\\s+V([\\d.]+)\\s+-\\s+restarts",
    "autoupdate": {
        "url": "http://www.uwe-sieber.de/files/restartsrdev.zip"
    }
}
