{
    "_comment": "checkver to be: FFB\\s+V([\\d.]+)\\s+-\\s+Flush",
    "version": "1.0",
    "description": "Flush file buffers",
    "homepage": "http://www.uwe-sieber.de/drivetools_e.html",
    "license": "Freeware",
    "architecture": {
        "32bit": {
            "bin": "Win32/FFB.exe"
        },
        "64bit": {
            "bin": "x64/FFB.exe"
        }
    },
    "url": "http://www.uwe-sieber.de/files/FFB.zip",
    "hash": "39cc8733c26a28b1acd5a9c7f12b9ea5f248ded4235f8912c4b7385e9a2b9060",
    "autoupdate": {
        "url": "http://www.uwe-sieber.de/files/FFB.zip"
    }
}
