{
    "architecture": {
        "32bit": {
            "bin": "Win32/RemoveDrive.exe"
        },
        "64bit": {
            "bin": "x64/RemoveDrive.exe"
        }
    },
    "checkver": "RemoveDrive\\s+V([\\d.]+)\\s+-\\s+Safe",
    "description": "Safely removes drives",
    "hash": "83fb65e81f645d46d302b1a0a0bcfae189548a609bbd5aeaa7b9297c75f3abf1",
    "homepage": "http://www.uwe-sieber.de/drivetools_e.html",
    "license": "Freeware",
    "url": "http://www.uwe-sieber.de/files/removedrive.zip",
    "version": "2.8.6"
}
