{
    "architecture": {
        "32bit": {
            "bin": [
                "ztw.exe"
            ],
            "installer": {
                "args": [
                    "/S",
                    "/D=$dir"
                ],
                "file": "ztw22x86.exe"
            },
            "url": [
                "http://www.zedtek.com/download/ztw22x86.exe",
                "http://www.zedtek.com/download/ztw24181.zip"
            ]
        },
        "64bit": {
            "bin": [
                [
                    "ztw64.exe",
                    "ztw"
                ]
            ],
            "installer": {
                "args": [
                    "/S",
                    "/D=$dir"
                ],
                "file": "ztw22x64.exe"
            },
            "url": [
                "http://www.zedtek.com/download/ztw22x64.exe",
                "http://www.zedtek.com/download/ztw24181.zip"
            ]
        }
    },
    "homepage": "http://www.ztree.com/",
    "license": "Proprietary",
    "uninstaller": {
        "args": [
            "/S"
        ],
        "file": "Uninstall.exe"
    },
    "version": "2.4.181"
}
