{
    "autoupdate": {
        "url": "http://www.giuspen.com/software/cherrytree_$version_win32_portable.7z"
    },
    "bin": "bin/cherrytree.exe",
    "checkver": {
        "re": "http://www.giuspen.com/software/cherrytree_([\\d.]+)_win32_portable.7z"
    },
    "description": "Hierarchical note taking application",
    "extract_dir": "cherrytree_0.38.4_win32_portable",
    "hash": "44fc5c5152fbb9398da6c96f47fbf543bd4792d6fa8cf6b63bd5fc67a9499fd4",
    "homepage": "https://www.giuspen.com/cherrytree",
    "license": "GPL-3.0",
    "shortcuts": [
        [
            "bin/cherrytree.exe",
            "Cherrytree - A hierarchical note taking application"
        ]
    ],
    "url": "http://www.giuspen.com/software/cherrytree_0.38.6_win32_portable.7z",
    "version": "0.38.6"
}
