{
    "bin": "time_it.exe",
    "hash": "8acdd6249cc168256a75900f51447d5b65105219eb61288b55c949e683bd7725",
    "description": "Time disk I/O",
    "license": "MIT",
    "checkver": "github",
    "url": "https://github.com/rasa/time_it/releases/download/v1.2/time_it-1.2-win32.zip",
    "version": "1.2",
    "autoupdate": {
        "url": "https://github.com/rasa/time_it/releases/download/v$version/time_it-$version-win32.zip"
    },
    "homepage": "https://github.com/rasa/time_it"
}
