{
    "hash": "f401521063b6c0ce30c8d659e7e5f7629abc07bdb6814adc2bda8b5a34cf7c92",
    "description": "Restart safely removed media",
    "license": "Freeware",
    "checkver": "RestartSrDev\\s+V([\\d.]+)\\s+-\\s+restarts",
    "url": "http://www.uwe-sieber.de/files/restartsrdev.zip",
    "notes": "RestartSrDev.exe reports it's actually version 2.0.1",
    "version": "2.2",
    "architecture": {
        "32bit": {
            "bin": "Win32/RestartSrDev.exe"
        },
        "64bit": {
            "bin": "x64/RestartSrDev.exe"
        }
    },
    "autoupdate": {
        "url": "http://www.uwe-sieber.de/files/restartsrdev.zip"
    },
    "homepage": "http://www.uwe-sieber.de/drivetools_e.html"
}
