{
    "pre_install": "& \"$dir/setup.exe\" /SP- /SILENT /NOCANCEL /NOCLOSEAPPLICATIONS /NORESTART /DIR=\"$dir\"",
    "bin": "Toms Hash Explorer.exe",
    "hash": "f9b205b73e3891dfd6d3aa455f2c922da0803af2f84fd73ea9bcef520d48d006",
    "description": "Calculate cryptographic hash values (GUI)",
    "license": "Freeware",
    "url": "http://www.mannerud.org/tom-andreas/downloads/Toms_Hash_Explorer_v1.2.zip",
    "uninstaller": {
        "file": "unins000.exe"
    },
    "shortcuts": [
        [
            "Toms Hash Explorer.exe",
            "Tom's Hash Explorer"
        ]
    ],
    "version": "1.2",
    "homepage": "https://www.mannerud.org/tom-andreas/software/toms-hash-explorer/"
}
