{
    "version": "1.97",
    "description": "Manipulate GIF images",
    "homepage": "https://eternallybored.org/misc/gifsicle/",
    "license": "GPL-2.0-only",
    "architecture": {
        "32bit": {
            "extract_dir": "gifsicle-1.97",
            "url": "https://eternallybored.org/misc/gifsicle/releases/gifsicle-1.97-win32.zip",
            "hash": "18ab50edd339e575a28c7c337a30237cf2084f6b437e78437f33ec8d2acf9ee4"
        },
        "64bit": {
            "extract_dir": "gifsicle-1.97",
            "url": "https://eternallybored.org/misc/gifsicle/releases/gifsicle-1.97-win64.zip",
            "hash": "bb3ad4e1521a3953152f406eaafabda153fb5986938405860a7e7f12a3d13227"
        }
    },
    "bin": [
        "gifdiff.exe",
        "gifsicle.exe"
    ],
    "checkver": "href=\"releases/gifsicle-([\\d.]+)",
    "autoupdate": {
        "architecture": {
            "32bit": {
                "extract_dir": "gifsicle-$version",
                "url": "https://eternallybored.org/misc/gifsicle/releases/gifsicle-$version-win32.zip"
            },
            "64bit": {
                "extract_dir": "gifsicle-$version",
                "url": "https://eternallybored.org/misc/gifsicle/releases/gifsicle-$version-win64.zip"
            }
        }
    }
}
