{
    "architecture": {
        "32bit": {
            "bin": "Win32/remount.exe"
        },
        "64bit": {
            "bin": "x64/remount.exe"
        }
    },
    "autoupdate": {
        "url": "http://www.uwe-sieber.de/files/remount.zip"
    },
    "checkver": "ReMount\\s+V([\\d.]+)\\s+-",
    "description": "Remount ejected volumes",
    "hash": "37f9761877cc1b0dc1806045e1d9435f535f226d8b2faefedf615b4de32cd72f",
    "homepage": "http://www.uwe-sieber.de/drivetools_e.html",
    "license": "Freeware",
    "url": "http://www.uwe-sieber.de/files/remount.zip",
    "version": "2.1"
}
