{
    "version": "1.11",
    "description": "Convert .PFM files to .AFM files",
    "license": "Freeware",
    "url": "https://www.slosipe.org/media/html2pdf/_tcpdf_5.0.002/fonts/utils/pfm2afm.exe",
    "hash": "b6582404f57010e8a000c1fd6b9ec6100016588a15c629ac615834c0125d132e",
    "bin": "pfm2afm.exe"
}
