{
    "autoupdate": {
        "url": "http://www.babelstone.co.uk/Software/Download/BabelMap.zip"
    },
    "bin": "BabelMap.exe",
    "checkver": ">\\s*Version\\s+([\\d.]+)\\s+\\(",
    "description": "Display Unicode character maps",
    "hash": "65aac63644ca83fcc4beb37b4895bfc852c8cba465e7a60686f40b9c622f5452",
    "homepage": "http://www.babelstone.co.uk/Software/BabelMap.html",
    "license": "Freeware",
    "shortcuts": [
        [
            "BabelMap.exe",
            "BabelMap - Unicode character map viewer"
        ]
    ],
    "url": "http://www.babelstone.co.uk/Software/Download/BabelMap.zip",
    "version": "11.0.0.1"
}
