{
    "architecture": {
        "32bit": {
            "extract_dir": "Win32"
        },
        "64bit": {
            "extract_dir": "x64"
        }
    },
    "autoupdate": {
        "url": "http://www.uwe-sieber.de/files/usbtreeview.zip"
    },
    "bin": "usbtreeview.exe",
    "checkver": "USB Device Tree Viewer V([\\d.]+)",
    "description": "USB device tree viewer",
    "hash": "9b03d8603d0b68a5e333a6b6cfa99d806a3c2da18cc2395322662c51f92cb55c",
    "homepage": "http://www.uwe-sieber.de/usbtreeview_e.html",
    "license": "Freeware",
    "shortcuts": [
        [
            "usbtreeview.exe",
            "UsbTreeView - USB Device Tree Viewer"
        ]
    ],
    "url": "http://www.uwe-sieber.de/files/usbtreeview.zip",
    "version": "3.2.3"
}
