{
    "architecture": {
        "32bit": {
            "hash": "d24a4928f0a5f5ccc4a325d65d1f90e5d4aa2e5b5ff3659777d552b99b77d662",
            "url": "https://github.com/bitbeans/SimpleDnsCrypt/releases/download/0.6.0/SimpleDNSCrypt.msi"
        },
        "64bit": {
            "hash": "99803f50ad4049f08513caa1ee080484aa9dd9257fab1f7f949e2c43cbd6e734",
            "url": "https://github.com/bitbeans/SimpleDnsCrypt/releases/download/0.6.0/SimpleDNSCrypt64.msi"
        }
    },
    "autoupdate": {
        "architecture": {
            "32bit": {
                "url": "https://github.com/bitbeans/SimpleDnsCrypt/releases/download/$version/SimpleDNSCrypt.msi"
            },
            "64bit": {
                "url": "https://github.com/bitbeans/SimpleDnsCrypt/releases/download/$version/SimpleDNSCrypt64.msi"
            }
        }
    },
    "bin": "SimpleDnsCrypt.exe",
    "checkver": {
        "github": "https://github.com/bitbeans/SimpleDnsCrypt"
    },
    "description": "Simple management tool for dnscrypt-proxy",
    "homepage": "https://simplednscrypt.org/",
    "license": "MIT",
    "shortcuts": [
        [
            "SimpleDnsCrypt.exe",
            "Simple DNSCrypt"
        ]
    ],
    "uninstaller": {
        "file": "Uninstall.exe"
    },
    "version": "0.6.0"
}
