{
    "version": "2.2",
    "description": "Manage local group policy objects (LGPO)",
    "homepage": "https://www.microsoft.com/en-us/download/details.aspx?id=55319",
    "license": "Freeware",
    "url": "https://download.microsoft.com/download/8/5/C/85C25433-A1B0-4FFA-9429-7E023E7DA8D8/LGPO.zip",
    "hash": "6ffb6416366652993c992280e29faea3507b5b5aa661c33ba1af31f48acea9c4",
    "bin": "LGPO.exe"
}
