{
    "autoupdate": {
        "url": "https://www.isobuster.com/dl.php?d=isobuster.com&v=1&l=0#/isobuster_install.exe"
    },
    "bin": "isobuster.exe",
    "checkver": {
        "re": "Download\\s+IsoBuster\\s+([\\d\\.]+)\\s*<",
        "url": "https://www.isobuster.com/download.php"
    },
    "description": "The ultimate data recovery software",
    "hash": "380ba4a7c9dcced8ad868f0334a1cf6d1bae8bbc93300143a98d830a317fe2a7",
    "homepage": "https://www.isobuster.com/",
    "innosetup": true,
    "license": "Shareware",
    "shortcuts": [
        [
            "isobuster.exe",
            "ISOBuster"
        ]
    ],
    "url": "https://www.isobuster.com/dl.php?d=isobuster.com&v=1&l=0#/isobuster_install.exe",
    "version": "4.3"
}
