{
    "version": "2.3",
    "description": "Remount ejected volumes",
    "homepage": "http://www.uwe-sieber.de/drivetools_e.html",
    "license": "Freeware",
    "architecture": {
        "32bit": {
            "bin": "Win32/remount.exe"
        },
        "64bit": {
            "bin": "x64/remount.exe"
        }
    },
    "url": "http://www.uwe-sieber.de/files/remount.zip",
    "hash": "9d258827401d2453a84e46acf76d074b9813f310cecb82c81f6a735a12d96a8e",
    "checkver": "ReMount\\s+V([\\d.]+)\\s+-",
    "autoupdate": {
        "url": "http://www.uwe-sieber.de/files/remount.zip"
    }
}
