{
    "bin": [
        "PolicyRulesFileBuilder.exe",
        "PolicyAnalyzer_GetLocalPolicy.exe",
        "PolicyAnalyzer.exe"
    ],
    "hash": "66cec3c3b1fc3ce4291011d367577d725fe8839460483559e7383f0d124dbc94",
    "description": "LGPO policy analyzer",
    "license": "MSEULA",
    "url": "https://download.microsoft.com/download/8/5/C/85C25433-A1B0-4FFA-9429-7E023E7DA8D8/PolicyAnalyzer.zip",
    "version": "3.2.1705.29001",
    "homepage": "https://www.microsoft.com/en-us/download/details.aspx?id=55319"
}
